{
  "$schema": "https://json-schema.org/draft/2020-12/schema",
  "$id": "https://spec.intent-platform.local/bundle/3.0/policies.schema.json",
  "title": "runtime/policies.json — fully-resolved policy tables (ADR-005 Part 2, ADR-003 §8)",
  "description": "Compiled, flat, complete. The tighten-only merge algebra runs in the compiler (stage 5); a runtime never merges policy. Matrix completeness over the intent set is proved at compile time, not by this schema.",
  "type": "object",
  "additionalProperties": false,
  "required": ["policy_schema", "policy_content", "confirmation", "thresholds"],
  "properties": {
    "policy_schema": { "type": "integer", "minimum": 1 },
    "policy_content": { "type": "integer", "minimum": 1 },
    "confirmation": {
      "description": "intent id → confirmation policy. High-cost actions must resolve to 'always' (medical wrong-action budget).",
      "type": "object",
      "minProperties": 1,
      "additionalProperties": false,
      "patternProperties": {
        "^[a-z][a-z0-9_]*\\.[a-z][a-z0-9_]*\\.[a-z][a-z0-9_]*$": {
          "type": "string",
          "description": "always = the intent declares a followup and confirms on every turn; never = it fires directly. There is deliberately no confidence-conditional value: a band that decides when to ask was removed in favour of a single fire threshold (docs/confirm-gate-diagnosis.md), and an app contract cannot depend on where the classifier happened to land.",
          "enum": ["always", "never"]
        }
      }
    },
    "thresholds": {
      "type": "object",
      "additionalProperties": false,
      "required": ["confidence", "interrupt", "semantic"],
      "properties": {
        "confidence": { "type": "number", "minimum": 0, "maximum": 1 },
        "interrupt": { "type": "number", "minimum": 0, "maximum": 1 },
        "semantic": { "type": "number", "minimum": 0, "maximum": 1 },
        "agreement": {
          "description": "Relaxed bar applied when two INDEPENDENT recognisers name the same intent — a keyword rule and the model, or the model and the semantic head. Corroboration offsets the softmax diffusion of a large label space, so a turn both stages agree on need only clear this instead of `confidence`. It is evidence strength, not a confidence: the reported confidence stays the model's calibrated probability.",
          "type": "number", "minimum": 0, "maximum": 1
        },
        "oov_reject": {
          "description": "Share of an utterance's tokens that may be absent from the intent model's vocabulary before the turn is refused, whatever the confidence. A TF-IDF vector has one slot per known term and none for anything else, so an unknown word does not lower the score — it vanishes, and 'turn off toshiba' produces a vector bit-identical to 'turn off'. Confidence is therefore honest about an input the model was never given, and no confidence threshold can recover the difference. Tokenise exactly as the featurizer does (default sklearn token_pattern) and compare against the model's UNIGRAM vocabulary. The value is a property of the vocabulary shipped with it: a client using the pruned head must use the ratio fitted for that head.",
          "type": "number", "minimum": 0, "maximum": 1
        }
      }
    },
    "limits": {
      "type": "object",
      "additionalProperties": false,
      "properties": {
        "max_slot_attempts": { "type": "integer", "minimum": 1 },
        "max_followup_depth": { "type": "integer", "minimum": 0 },
        "session_timeout_s": { "type": "integer", "minimum": 1 }
      }
    },
    "experiment_overlay_id": { "type": "string" }
  }
}
