{
  "policy_schema": 1,
  "policy_content": 2,
  "confirmation": {
    "audio.volume.mute": "never",
    "audio.volume.set": "never",
    "reminder.task.create": "always"
  },
  "thresholds": {
    "confidence": 0.7,
    "interrupt": 0.75,
    "semantic": 0.55,
    "agreement": 0.5
  },
  "limits": {
    "max_slot_attempts": 3,
    "max_followup_depth": 1,
    "session_timeout_s": 120
  }
}
